{
  "schemaVersion": "seven-governors.neo4j-deployment-roundtrip-validation.v1",
  "verdict": "PASS",
  "releaseId": "seven-governors-integrated-1.9.0",
  "targetClass": "disposable_local",
  "credentialsExcluded": true,
  "checksPassed": 3,
  "checksFailed": 0,
  "checks": [
    {
      "checkId": "configured-bootstrap",
      "status": "PASS",
      "diagnostic": {
        "nodeCount": 3061,
        "relationshipCount": 10506
      }
    },
    {
      "checkId": "configured-roundtrip",
      "status": "PASS",
      "diagnostic": {
        "snapshotFingerprint": "5d26a803e61fab385f7c183a8f21e5416f8fa8c5c4a0692500bbec8bc3e9c564"
      }
    },
    {
      "checkId": "bootstrap-roundtrip-byte-identity",
      "status": "PASS",
      "diagnostic": true
    }
  ],
  "normalizedSnapshot": {
    "snapshotFingerprint": "5d26a803e61fab385f7c183a8f21e5416f8fa8c5c4a0692500bbec8bc3e9c564",
    "namespaceFingerprints": {
      "topology": "5504690205e5d06adbbecbeddba03deaef746b9ca219835285dcf80f4c0c2c24",
      "provenance": "d2bd1f6df27496167e7d0df84f40a891ac08342a3581f70802bb19f383bd42b8",
      "mutation": "50e6f2c2bfa8c685cbdca34acac2e88c68b1cf92fdf7f3f1b9f04afe8f1062e5",
      "semantic": "5ce8d0969416fbd3e414ca54975aa2a3f628887462b171a8259db2a18d0395d7",
      "governorRuntime": "7f3bce665fff468f1f6e19b8bb72dd2d81e232b31b77d739d37e26e4ebed5222",
      "court": "5eafe5e5970a2a286a4bb24525c0bf6c5bbee57da4343826022eeb3dc1573422",
      "gov210": "4644528335fcb6c06280d5f4a67f05c2c14918f1bbfd9e7561732d95b510dd24"
    },
    "sourceBindings": [
      {
        "namespace": "court",
        "path": "tests/court_graph/fixture-input.json",
        "sha256": "ed46bb74a84a28348ac0c004e0f4501282fe02b6fbd97950bd8df7eb24894455"
      },
      {
        "namespace": "gov210",
        "path": "canonical/gov-210-availability-housing.json",
        "sha256": "7382b8ca818682a95b9f6f8d75e3130762ae992f761c1e25de7e31905d214858"
      },
      {
        "namespace": "governorRuntime",
        "path": "seven-governors-governor-runtime-v0.1.0/canonical/policy-release.json",
        "sha256": "ab0a9d2827ae262a0e85bcaf3882839e070520ae596fa2c87d68ab0e1eae33d8"
      },
      {
        "namespace": "mutation",
        "path": "seven-governors-mutation-algebra-audit/audit/operator-applications.csv",
        "sha256": "1f7b2abb047132fa957f761a73e7c76038766f617bed9c916f971a8c0072f53e"
      },
      {
        "namespace": "provenance",
        "path": "provenance/release.json",
        "sha256": "bcac8d87c53b52e5b8649d76c6d60cb0ef2b79ba6bfaa3330e3abca9adde0492"
      },
      {
        "namespace": "semantic",
        "path": "seven-governors-canonical-feature-profile-registry-v0.1.1/canonical/registry-release.json",
        "sha256": "5072761cb53b98a1c0fa99cb6807f148963ca8ec8394af461b2c9822553f0a22"
      },
      {
        "namespace": "topology",
        "path": "canonical/universal-network-data.json",
        "sha256": "21e2a632837ecf40fe9229e9eb4ec0a5cceb9e2043fe89cb8e1d320518d7bdbc"
      }
    ],
    "counts": {
      "nodeCount": 3061,
      "relationshipCount": 10506
    }
  },
  "evidenceBindings": [
    {
      "path": "canonical/gov-210-availability-housing.json",
      "sha256": "7382b8ca818682a95b9f6f8d75e3130762ae992f761c1e25de7e31905d214858"
    },
    {
      "path": "canonical/universal-network-data.json",
      "sha256": "21e2a632837ecf40fe9229e9eb4ec0a5cceb9e2043fe89cb8e1d320518d7bdbc"
    },
    {
      "path": "court-mathematics/pyproject.toml",
      "sha256": "48bd8d45d08de33c5c5e104899f8055384fe0a9c2dc01981ed011fba1fba199a"
    },
    {
      "path": "court-mathematics/src/court_mathematics/__init__.py",
      "sha256": "1902de95765cdc329fd8e6d9406edf055b2903ba99a119c60096902aa014b1ba"
    },
    {
      "path": "court-mathematics/src/court_mathematics/_canonical.py",
      "sha256": "b431d30641520fa1bffa8ea643417fe0897150f02ef540bc0319a17f3f2667a0"
    },
    {
      "path": "court-mathematics/src/court_mathematics/harmonic_profile.py",
      "sha256": "7751fecbc760fb6c3b5910b87da8ee89888e8c6db2ecaf605275395274571bd0"
    },
    {
      "path": "court-mathematics/src/court_mathematics/pitch_class.py",
      "sha256": "0ebd9e91cab7c72cdb445f2405c31cc64031aba3e0653f08e020c6add45ba65c"
    },
    {
      "path": "court-mathematics/src/court_mathematics/subset_lattice.py",
      "sha256": "dde4acbe6f5e49783c95c8d1546362473aabb31f997a4aaac9159ae8f0399b9a"
    },
    {
      "path": "court-mathematics/src/court_mathematics/triads.py",
      "sha256": "396ced4501247fbe0d2362ed1b911a9fa72a02e0bb58e47fcb3dedf13b4f129e"
    },
    {
      "path": "court-mathematics/src/court_mathematics/voice_leading.py",
      "sha256": "17759c0fd7bc98384c88513367370791464788be2cc3a6dffc5a1d8876cc34e6"
    },
    {
      "path": "graph/runtime/canonical.mjs",
      "sha256": "8200fbf347992f37ce2a13737c76a0f5055e0cddb240f6f30d792db6306fd7d6"
    },
    {
      "path": "graph/runtime/contracts.mjs",
      "sha256": "f6ca78538d1aad1469bc5766fcdbfa0fe6ec5fdf99fd96517f03ca889f6f14cb"
    },
    {
      "path": "graph/runtime/neo4j-bootstrap.mjs",
      "sha256": "fbe48b913c6fefd9aaca642132138b45e5838bcd851a9575b6059debd91ed821"
    },
    {
      "path": "graph/runtime/neo4j-evidence.mjs",
      "sha256": "d21fdb06ce2e05618ab59fed3af2d90e3ddea77430703987f128837b2636d3d1"
    },
    {
      "path": "graph/runtime/neo4j-harness.mjs",
      "sha256": "5a432d82b48cd4fcd3cf8fa7484828f16c106606dda5048284b318a8ca5a5da9"
    },
    {
      "path": "graph/runtime/neo4j-roundtrip.mjs",
      "sha256": "60e8ce3609a3d36b3c8053ee796eb8ab9b87a8b896d41ac7be00c8f54a3cfe2b"
    },
    {
      "path": "graph/runtime/providers/file-provider.mjs",
      "sha256": "5594006ad1fbb56b7da6693c3670e6f80bd26a0c07972359cb17f8506076b5f6"
    },
    {
      "path": "graph/runtime/providers/neo4j-provider.mjs",
      "sha256": "863e890268069ae49b2ab5ad0fb80c5190c3aa3db302cd26a7a6e48a08d9aef8"
    },
    {
      "path": "graph/runtime/providers/snapshot-provider.mjs",
      "sha256": "64fe06dd26f51f8c8662a894bc41a5187390f7fbcdcac6b9cbd01734f1fe75e3"
    },
    {
      "path": "graph/runtime/query-api.mjs",
      "sha256": "19004eb6f66aeac1b59d21dbd4393a145ba7c7a879917e332fadd7b9d60c5863"
    },
    {
      "path": "graph/runtime/query-catalog.mjs",
      "sha256": "c6e7f5a4bb87f0fb190e54bc5879271408d38c83fd58dbc2f6953f0523fd5e94"
    },
    {
      "path": "neo4j/court-mathematics/schema.cypher",
      "sha256": "8b7e878461ed24a097716d514a02c750159cec838b07a8cd4812507c34f71bcc"
    },
    {
      "path": "neo4j/court-mathematics/validation.cypher",
      "sha256": "46d6a51ebafa34b26b75a60df24b1d5dee0a2718c3a7216fc0ae8d23f2e6c9e2"
    },
    {
      "path": "neo4j/csv/audited-hamming2.csv",
      "sha256": "adfd3bab011e5edd9ce2ddbb4fb78841019c48fac1de8b3db57cf57f08df7924"
    },
    {
      "path": "neo4j/csv/belongs-to-family.csv",
      "sha256": "21b50b96a4bcd6385735f9cade6cbf947acbf27de77290b84b77c7af48a9563d"
    },
    {
      "path": "neo4j/csv/constructs.csv",
      "sha256": "9c0216a2a488ddbad768d0a0d6e780a9048ea46152acfe5ed552affb4431fd83"
    },
    {
      "path": "neo4j/csv/convergence-contact.csv",
      "sha256": "515d847d72e4bb0b7f19455c832a4455dee6b6b8b1a6534b5ac568cc55e9281f"
    },
    {
      "path": "neo4j/csv/governor-offices.csv",
      "sha256": "53e7a6527be64b59cc76f73a02536cf3ffb1ef90bfea508456b408ad22ad5508"
    },
    {
      "path": "neo4j/csv/governs.csv",
      "sha256": "6c74ee16cb47faf514b9a3acc06cb60a95899801e7d286764f745508ba9225d2"
    },
    {
      "path": "neo4j/csv/identity-ledger.csv",
      "sha256": "1df36a5f6684db35b189cb74addd0b739e062ee224f8f91a35f9f94901ff496c"
    },
    {
      "path": "neo4j/csv/junction-contact.csv",
      "sha256": "1663e1e817acea4c2133efbf60bafc77f35390ac7f6a47a0ec082c648f9137ec"
    },
    {
      "path": "neo4j/csv/leaf-contact.csv",
      "sha256": "cbbc2e46017f9d4d4a7f4541e7ae33557c297c098f8beca0465caddafe751676"
    },
    {
      "path": "neo4j/csv/modal-successor.csv",
      "sha256": "ba83d4e1fd48e79ade08ae7a901ab965e181d877a79466f763e664b4b3d0ce97"
    },
    {
      "path": "neo4j/csv/occupies-office.csv",
      "sha256": "fdbe2ca2be9b54fc7df09cc37e47c3ef13f105c42af8fa7728a9776b262b753d"
    },
    {
      "path": "neo4j/csv/phase-shift.csv",
      "sha256": "a46b9e7fcfc0e8a34b5c7abd3dc59043abdc8c93eeda4c9c218706f805ce5365"
    },
    {
      "path": "neo4j/csv/relational-office-evidence.csv",
      "sha256": "7c67c25f55b314739a46a6073ca9c67ac42a6862289de049bdee68f48df769fd"
    },
    {
      "path": "neo4j/csv/relationships.csv",
      "sha256": "86d3abee6ed86950f49f6015c4b9f7a72e2495286df40cf82e8a5c1194eae3e2"
    },
    {
      "path": "neo4j/csv/scale-families.csv",
      "sha256": "eb5fe1a87857945b80fefb425bd13fe274be379aae86b37afe1a3d8ab0551347"
    },
    {
      "path": "neo4j/csv/scale-states.csv",
      "sha256": "1df36a5f6684db35b189cb74addd0b739e062ee224f8f91a35f9f94901ff496c"
    },
    {
      "path": "neo4j/csv/seat-contact.csv",
      "sha256": "6192f754ce0daa68ec7d69c080fda84616c0f5cf885d17df25c6f3f7d2134096"
    },
    {
      "path": "neo4j/gov-210/schema.cypher",
      "sha256": "66b7dd8889dabd25448aee67632c488833b0b2c6818ff62f5dc5b2e846726199"
    },
    {
      "path": "neo4j/gov-210/validation.cypher",
      "sha256": "d06487b15e3085f8999d6e79022b4312d14e548184472565bc74270550a67d15"
    },
    {
      "path": "neo4j/governor-runtime/schema.cypher",
      "sha256": "466b9199cee75ba3e71bf455b7129cd95b489313e362e59849ed8f3778e3b608"
    },
    {
      "path": "neo4j/import.cypher",
      "sha256": "b7d0267b4b35f884cfc68a481c5899511c82105daab913dbf3e9634c1d26c7b2"
    },
    {
      "path": "neo4j/provenance-validation.cypher",
      "sha256": "a5269db18c2e705cbc2fedfb16f64c2e14810773fc3e7373be7d9d72d314cf7c"
    },
    {
      "path": "neo4j/provenance.cypher",
      "sha256": "bba8e1b0b7e97ab7be17e56f327d62dcc5c3c1bb326263e3878d87505e83dd94"
    },
    {